{
  "name": "Eight_Bears2",
  "displayedName": "8 more fucking bears!",
  "description": "Kill this other abomination please",
  "metaCategories": [ "ChoiceNode", "TraderOffer", "Rare" ],
  "cardComplexity": "Intermediate",
  "temple" : "Nature",
  "baseAttack": 64,
  "baseHealth": 96,
  "bonesCost": 10,
  "abilities": [ "Sharp" ],
  "appearanceBehaviour": [ "RareCardBackground" ],
  "texture": "eightfuckingbears.png"
}